time,danmu
592.90200,当时我爸妈都收到召回通知了，印象深刻
588.20100,当年朋友圈这张图刷屏
911.19800,我们之所以看不到黑暗，是因为有人拼尽全力，把黑暗挡在了我们看不见的地方
843.35000,讲真，当年美军航母的舰长间接拯救了全世界
759.41100,我也看了这个没想到这块
211.89400,如果中国人都活不下去了，那还要地球干什么？！
912.30000,国人加油！疫情退散！
371.78200,打的一拳开，免得百拳来
379.67800,福建舰来喽
445.11800,拼命了
560.79800,闯领海就是做大死了
529.21400,应该是准备真干了，但是不会是全部家底
820.77800,以后南海只有自古以来 没有所谓的搁置争议共同开发
675.50000,原来当年南海局势这么严重啊
855.67700,太阳照常升起
348.77600,2022年，003福建舰已经下水，加快针对台海问题
474.60200,不装了，摊牌了，我虽然没有能打的航母，但是我有能打的导弹。
19.28500,南瓜
42.42500,知道两个两个航母战斗什么概念吗，里面搭载的战斗机和对地对空导弹就能瘫痪整个东盟
542.65700,以下克上老传统了！
828.74000,兔子:这下好了，我可以摊牌了
926.39900,威武之师文明之师
11.26000,那时候我高考完等通知书
309.81200,等等 这个BGM好像是红警3的？？
486.90200,俄罗斯:RNM！菲律宾看看你帮的好事
427.83400,百舰
618.69900,不是摆给美国佬看而是真正的做好第三次世界大战的准备。做好美国十首航母来侵犯也要消灭它的战争
31.84000,当时全部梭哈上去了
460.84000,要核战争啊
470.59300,但是有核潜艇
782.68000,哈哈哈哈
356.43500,真的是抱着玉碎的姿态
783.12400,美国:……
923.38200,此生无悔入华夏
874.63300,。。。。。。。。。。
459.68900,决战装备
35.62000,顶上战争
50.49200,22年前来考古 三航母了宝贝们
341.85300,003进入直播间
505.25100,核战争一定会有一个赢家
268.90200,中立国现在要加入北约拉
171.75300,斯诺登事件
788.29200,菲律宾：我宣布中国是我新爹
365.14000,如果你真的了解东风，也不会说出拦截导弹这种搞笑话
84.26000,唯一一次美国能在南海打赢中国的机会。，他却溜了
266.99800,瑞典老中立国了
650.26000,当时我头上全是武装直升机，你跟我说平平淡淡？
718.02000,老鹰没有感情
125.00000,入则无法家拂士，出则无敌国外患者，国恒亡，然后知生于忧患而死于安乐也。
413.42200,岸基导弹基本上无限量的
258.58300,你跟我谈历史？那我就不困了
7.58000,003下水重温一下
427.10000,海军基本上直接梭哈了
462.02600,要么不打 打就是灭国战 
426.23000,现在我们的航母都有三艘了
38.10100,gtx690
351.10200,2022，003已下水
704.86500,这才是关键，敢打还要必胜
692.80900,第二个是根本原因，美国不可能因为小弟的利益和中国正面对垒
519.10900,货真价实的“一半的美国海军”
765.43900,阿三：没错！正是在下！
533.91600,从此之后，就变成驻韩大使了！
10.98000,003已下水，再来重温当年的南海！
668.57600,致敬
494.19400,枪管子都块戳进对面的鼻子眼儿里
256.43000,对着中国讲历史
569.45000,兔子太难了吧
344.46700,003下水了
137.05300,2022年日元兑美元贬值成不像话，看样子做舔狗的国家毫无卵用
302.73600,兔子连打了十几个堂口，联合国算个屁
156.20800,不治身亡=压根就没治
309.57300,现在003下来了再来看一遍
907.01800,中国无意成为任何国家的对手，但若是有谁执意将中国视为对手，那中国一定会做一个合格的对手！
48.87800,俄罗斯早已在我们之下
54.08400,福建舰已经服役了
477.39300,中美关系压舱石
746.08200,连央视都能说出战云密布，可见当时气氛有多紧张
607.73900,。。。。。。
697.76900,绝杀
747.88700,能作为中国“强敌”的，是谁不用说了吧
463.80200,福舰舰
343.43300,现在3航母了
8.35900,入坑之作
114.15300,我们普通百姓真实感受不到，国家一路走来多艰难！
449.59600,这个射程图非常好，非常人性化，正对美国
534.58500,这货相当第二个麦克阿瑟
863.31300,确实，南海战争后南海周边的国家都老实了不少，再也不敢说话了
838.43300,当时哈里斯确实没有听从命令就敢擅自对中国舰队开炮
699.30000,其实这里美国已经输了，因为战舰位置暴露，黄岩岛有大量美军舰队在埋伏
643.86000,当年真的一点都没感觉到，那会真的以为还是和往常一样平平淡淡
413.29900,请欣赏新贯口《报舰名》
846.19800,危机危机，不仅是危险，更是机遇！！！
329.14000,秦始皇：你给劳资个地球仪，现在全球说中文
515.20400,提康德罗加级
393.60000,我记得是航母被发现了！美国没办法了才走的！而当时哈吉斯都准备命令攻击了
349.14000,（第一岛链内除外）
542.16000,热爱祖国，为国家奉献，是每一个国民的责任和义务，因为有国才有家！
111.24000,消灭世界的吸血鬼！全世界无产者联合起来！
498.15000,但记住这个时候我不知道航母在哪，这个时候美国还是很狂
866.15500,突然发现原来自己在中国的真理范围之内
832.39400,釜山楚水凄凉地，二十三年弃置身
287.95300,秦始皇：早知道我就把欧洲那边打下来
71.14700,苏联直接苏醒
885.48500,鹰酱又被踹了
711.88000,高手之间，点到为止
667.95900,无线电静默=不接收任何命令 便宜行事
485.88800,不针对任何人（指针对的就是你）
225.49900,注意CSIS
192.97100,《亿些》
186.11900,嘴炮之王：坚利美
168.59900,美国：直接念我身份证得了
875.70800,奇怪的比喻增加了。。。
382.03300,您的东风快递请签收！
489.50000,菲律宾:卧槽玩真的？
674.88600,我那天晚上都紧张得睡不着觉
680.97800,阿基诺差点引发三战
176.41000,嗨呀，世界上有这么巧的巧合？
17.81800,里根就是那个好莱坞三流演员的里根吗？
791.67300,尊严只在剑锋之上，真理只在大炮射程之内
719.45000,那个时候火箭军的南海可是有着绝对统治力，他们不可能顶着火箭军的火力打仗的
277.86600,“最蠢”，指造就当时最强大的国家
528.84700,美军精锐=被兔子揍
487.47500,菲律宾：第三方其实是我
437.35000,能出的都出了，就是要拼命的架势
735.07000,对付美国只有跟他同归于尽
418.37100,报菜名
501.63500,但凡来个岸防炮（bushi）
19.68100,打海战还真不一定打得过美国……
885.29800,奇怪的比喻增加了
282.69300,嬴政：老子那是是当年没船，有船的话还有你什么事了？？？
713.49700,美帝专属副本：长津湖
308.82000,嬴政：但凡老子活着，还有你们的是，地球都是中国的
311.16500,德国：签过的也一样
847.96900,老  下  克  上  了
692.17800,原来是这样啊！“若有战，召必回”
355.36700,礼貌：你东风家族吗？
713.16000,最后询问白宫命令，说让撤，但哈里斯私自下令开火开战，确认程序的参谋向白宫最后确认命令后给拦下来了
15.64200,这个我记得，当时空间炸一片
626.44100,没声音的时候才是最危险的时候。
379.00700,红星二锅头白酒还没烧美国呢。
772.87600,尊严只在剑锋之上，真理只在大炮射程之内
643.58600,当时暑假还在放《东方战场》，我一直在追这个
595.62000,那个时间点正值里约奥运会，所以这件事显眼度小了点
642.96400,当年局势很严峻
234.91500,不要怕，三哥已经开始反噬美国了，美国已经开始种姓制了
909.49100,感受你描述了光明背后的挣扎
159.42600,"死因:背后中枪""自杀″"
380.62600,《东风了解一下》
771.76000,菲律宾：我被真理（武力）说服了！
142.23900,霉国可不允许中日韩勾勾搭搭
853.19900,施琅:福建水师提督升任大清国水师提督
660.93900,我们不是活在一个和平的年代，而是活在一个和平的国家！！！
438.00000,六爷：你们这些后辈努力点，我就不用出场了
120.10800,俄：我呢
114.55800,不是突然意识到
563.86000,我记得那个时候我爸突然问我，如果咱们这打仗了，你敢上去干吗。
17.50000,永远有人在看系列
353.43800,心酸啊，一路走来不容易
519.73700,在现代导弹部队面前，尤其是火力不足恐惧症刻进肌肉记忆的中国，还是那句话，射程内，发现即摧毁
666.26000,哪有什么岁月静好？只是有人在为我们负重前行！
609.90500,这个当时真的很严重，追星群里讨论的都是要打仗了
205.77300,感谢大自然的馈赠，才能吃到新鲜蔬菜
445.52100,那时海军真跟美军碰还是很容易就碎了，还得看东风
16.09500,他们拿两个航母战斗群来挑衅，说明他们怕
229.37500,当年是菲律宾，现在是乌克兰，都是美国的工具人。
682.34700,纵使美帝众国是虎狼之师，只要手里有家伙事儿也不怕他们！
492.88700,谁也不相信对方能善罢甘休！
94.28100,大洋上打不过美国，但在家门口美国却也根本占不到便宜
76.75800,在海牙公约的会议室开的会就算仲裁了？
805.45600,这个表示，南海是我的啦
870.54200,乌克兰：太对了哥
419.47600,四位上将的意思是说，如果有一位不幸牺牲，那么指挥权向后平移。
538.18200,直接血脉压制，反向给我们上buff
912.85000,吾辈当自强
478.02000,当时是真准备拼命的
8.01900,都是来补课的嘛
781.70000,我当时还奇怪菲律宾怎么忽然怂了，大国博弈凶险万分。
624.36200,无线电静默
529.17900,老子打的就是精锐！
484.06700,菲律宾：我不打扰，我走了哈
317.31100,法国：对对对
582.26500,麦克阿瑟当年也以为中国绝对不敢打。
65.66100,李肃吹爆的一刻
732.60100,俄罗斯：精彩
65.97900,这就是强国底气
567.10500,当时真的就一触即发
435.46500,真的是把家底都拿出来拼了
490.26700,此时最慌的事菲律宾吧，在咱家门口俩大国快打起来
691.13100,美国：我试过了兔子急了真咬人，大家别去搞事了
825.04600,正道沧桑
620.43700,战争从来就是这样你准备好了他反倒不来了。
897.07800,打遍五常，专治第三，被迫五杀，无奈超神
460.39000,当时我只是海军直升机技师，但还是不敢跟我爸说实情
547.15300,好家伙，鬼子，我军的抗战buff直接拉满
289.54000,秦始皇:但凡我当时有地球仪
515.33900,别低估航母的战斗能力，航母的视野和指挥能力是非常强的
148.32300,CIA:看我干啥，我啥没干啊
695.37000,这就是告诉美国你的航母坐标已经暴露，东风21D就可以获取锁定进行斩杀
825.54500,发 配 边 疆
867.90900,草，这比喻绝了，美国越来越硬气不起来了
202.23900,祖国:我只想安安静静的种个菜。
148.73300,身中40枪叫做“自杀”
642.19400,行为指导，东京电视台
415.52000,请欣赏相声口才《报舰名》
648.33600,有人在为我们负重前行！致敬！
861.18000,不见得，麻烦是麻烦，可是打得一拳开，免得百拳来。
426.11000,运城排面
588.26000,互丢核弹，一起玩完
914.45700,美帝亡我之心不死
451.89100,马上就到你家门口！
273.11300,南美的领海划分比中国丧心病狂多了
279.82200,长城:……？
0.00000,福建舰三航母时代前来考古，致敬英雄
905.85800,我们之所以看不见黑暗，是因为有人拼尽全力，把黑暗挡在了我们看不见的地方
259.79800,黄帝和蚩尤进入了直播间
775.61800,披甲龙龟：喵喵，正是在下！
893.70200,中国人民解放军陆军，海军，空军，火箭军以及中国人民解放军战略支援部队。
167.78000,@CIA
288.50700,秦始皇：蒙恬！给他整个活！！！
282.30100,忽必烈：要不是当年有大风，日本早就是俺家的了！
766.17800,正好掉了个头
827.05800,发配了，哈哈哈哈
252.73400,和中国聊历史依据？ 
11.91700,1600万了
756.79000,引弓待发！！！
239.84800,环顾四周，全是米国借的刀
53.57900,现在三航母啦
619.77400,无线电静默
415.91300,合肥舰排面
292.47600,嬴政：我才知道西边那块有块大陆，哪天把他打下来
52.78300,福建号大型渔船已下水
429.98000,当年052d是最新型，泪目不已
249.23300,菲律宾你听着只要你打下来就都归你，如果你不想被核弹洗地的话就来打
494.79000,菲律宾：你俩玩真的？
149.65500,安倍晋三在2022年7月8号被刺杀了
130.50800,这里美国坐不住了
913.56400,致敬！
538.17700,哈里斯这件事后直接被罢免
514.48600,感觉背水一战了
419.76600,你知道一点五倍速我都给你跪了吗
152.65800,安倍无了
673.06200,白匪，哼，定叫他有来无回！
240.74000,有打野！要不然对面不敢这么嚣张
602.34000,说南海是观音的，南海神尼不答应
587.89100,如果中国人都活不下去了，那还要地球干什么？！
470.88800,兔子：你敢抢，我就掀桌子
306.89800,Gtx690可以摧毁航母战斗群doge
212.02000,自古以来？？？？
56.35900,数据泄露了
761.06000,东风快递，使命必达
749.84800,tu-154飞机
626.91000,紫禁之巅！
835.62500,老子打的就是精锐没错了
424.13200,当时我国家底尽出啊。。
441.54200,这个核潜艇可得美国骂，哈哈哈哈，痛快！！！
431.54800,可惜没有055
862.03000,荣誉马来人
601.61000,我不配活着
461.13900,对不起，每一次听这一段都忍不住落泪
128.25300,永远都觉得可惜
657.38700,那天一直在天涯上关注
21.02200,003下水再来考古
904.93700,现在就算了
605.93900,还是感谢祖国的强大和发展，才有我们和平安逸的生活
13.90900,003下水啦！
112.06700,已经哭了
880.77900,能不能把收入分配搞搞
296.13300,长城是古代信息高效传递的有效手段，美国的这种言论实在是太过于低端了
605.02700,1130
406.07300,一级战备
517.49800,菲律宾：我何德何能
190.12700,那谁是嘴炮呢
662.03400,哪儿有什么岁月静好，只是有人替我们负重前行！！！
204.42700,现在看来，当年没有跟日本签哪玩意儿，对我们反而是好事儿
805.56900,.
733.82100,我说南海怎么突然没声儿了，原来是对峙过了
541.69800,日裔美国人，笑死，buff叠满了
2.43000,镇站之宝了
825.49800,好怕怕呀，要不再在南海填海修个机场吧，就黄岩岛吧，给我们压压惊
147.90000,突然鸡皮疙瘩起来了
169.45600,美国先来印太战略的，我们的是不得不破局
931.58100,我辈岂是蓬蒿人
140.87900,当时中国还在围剿西方金融资本
288.79100,因为那时候没航母所以建岛灶机场
20.77900,003福建舰报道
205.13700,隔壁的鹰酱馋哭了
376.79900,福建舰下水了
829.50000,汪汪汪汪
793.57600,爷投共了
929.58800,致敬
525.73200,老子打的就是精锐！
269.67400,《忠利》
912.89400,对峙结束之后，我们甚至云淡风轻一般，真的很强大，格局啊
334.39800,秦始皇就别拉出来了吧
902.71200,我觉得真打起来，美国也讨不到好，至少2艘航母会被干掉一艘
424.16900,看得我热泪盈眶，虽然难，必捍卫！
783.31400,菲律宾:我只是个幕的【狗头】
774.84500,杜老总算这个拉丁亚洲国家少见的有能力的领袖了
296.13900,美国配谈历史
50.03500,不看了，满口胡话
666.37400,遗书……泪目了
928.28400,来考古的003下水了
608.89700,扯呢，一级战备
666.54600,那时候只能想着活过今天，哪里管得了后面
169.57900,有美国我这个世界就不会好了。
159.35300,《死亡原因不明》
12.26600,6.17福建舰下水，回来考古
707.61900,都是种蘑菇的老铁，看着办吧
920.83500,003下水时期前来考古。
346.63500,福建舰今天下水了！
517.96600,给菲律宾吓麻了
292.70500,秦始皇：？敢不敢和我比划比划，要不是老子没有世界地图整个世界都是爷的！
27.80200,今天003航母福建号下水了！！！！！！！！！！！！！！！
279.26700,你们的3个岛链才是。。
81.14000,死伤几千人控制石油，控制世界命脉叫没捞到什么好处???
902.53700,川建国牛！！！！
914.45400,致敬
24.55300,003来了
421.17500,来了，来了，报船名
101.43900,中国人刻在骨子里的钢铁意志！！！
51.95900,我们有003了
0.76300,还有谁？！！
0.51500,生命力最强，意思就是可以多挨几发
696.42100,这张当时我看过
610.99100,在自己家门口，拿出所有家底，对抗美军两个战队。吾辈铭记。
712.98000,当时菲律宾和日本舰队都开始撤离
679.90000,当时白宫一旦授权，美国舰队就会开炮攻击中国舰队
147.85900,因为他欠了《中日货币互换协议》导致被日本亲美右翼势力迫害而死
373.42200,东风：你赞没了，三连没了
776.73000,杜特尔特还行，他现在就一直在端水，看怎么把一碗水端平
591.83900,一  级  战  备 ！
406.26200,舰  队  决  战 ！
653.18200,听说东风已经上了发射架，然后几年后央视一笔带过
351.78000, 让子弹飞 真的是太经典了 
586.53300,原来比如，当时这个图到处都是
882.70200,毒教材事件就知道敌人从来没有放弃
377.46500,真打起来，谁还管什么P合约，再说美国已经对日本使用过核武器了，它不符合条件。
368.93600,"整个单位让写了""家书""，当时打了两发"
843.32600,日本：当年我就是这么玩死的
287.95300,秦始皇：早知道我就把欧洲那边打下来
377.29800,打不了大家一起无嘛
893.90100,只有不怕死的人才配活着
864.49900,给你两个币，加一个大拇哥
210.05500,留得良田在，何愁不破敌?
143.60100,众所周知，背后中弹是自杀
652.17200,那有什么岁月静好，只不过有人在为我们负重前行
523.57300,老子打得就是精锐！
174.07600,BGM是红色警戒3的，不是帝国时代3的↑
154.90500,《突然》
556.47900,原来是个日本在美国的间谍，同时削弱中美战斗力，对日本最有利。
909.88800,最后这几句，真的泪目了
295.92000,违 背 国 际 法
797.29300,这就是真理
335.25100,但凡当时中国知道海外有别的国家就不会有后面的这些事了
428.59200,当时真是欺人太甚
517.43300,兔子的那几艘神秘消失的核动力潜艇对美帝的威慑比美帝的核动力航母对兔子海岸线的威慑更恐怖
67.94500,大不了你把东南沿海都拿走，老子跟着党去打游击也不服软
409.82200,当时记得有一天晚上家旁边的机场一架架起飞机
77.89500,世界三大真理之一
41.85700,美国：来10个航母 ，你想得美
560.30800,老子打的就是精锐
878.67600,兔子：枪在手，跟我走，杀美狗
271.74200,刑不上五常
72.41900,吹什么俄罗斯，啃苏联老本，经济跟渣一样，这个局势也就大帝能稳住了
559.25700,传 统 艺 能：下 克 上
369.06000,对付疯子，只有刀架在脖子上，他才会思考讲道理
47.23600,俄罗斯常规军力快去一边凉快吧
229.90600,又当运动员又当裁判
437.64000,那时是准备“换家” 和前苏联一样
660.50200,岁月静好，是有人为我们誓死捍卫的
10.38700,只有不怕死的人才配活着
826.07800,战场抗命、私自下令开火的家伙，哪还敢继续让它管军队，要不是“最后确认命令程序”就真开战
558.22200,当时美国大兵都吓哭了
262.18600,《 中 立 》
21.35000,再来亿遍
506.08900,一发DF—41就干掉斯坦尼斯号（加核弹头）
506.08900,一发DF—41就干掉斯坦尼斯号（加核弹头
465.79100,兔子要吃鹰酱了，happy
421.58800,这次军演前海军召回了很多技术骨干退伍士兵，可想而知这次有多重要。YYDS！！！
202.00700,种菜（划重点）
569.41500,主动进入陆基导弹射程图啥？
627.40200,无线电静默，是准备要开打的
879.71900,奇怪的比喻增加了
806.47900,是我们赌赢了。面对当年苏联的西方81军演先辈们也赌了一把，是我们赢了，是我们赢了。
824.52800,好        活        儿
8.03500,从酒痴东梦来的
105.74800,不是忽视太久了，而是尽管重重的打压，中国坚持坚强地站了起来。
530.47700,老子打的就是精锐
334.46300,《库尔斯克》
184.53100,2022三哥直接对阿妹开喷了，真的魔幻现实
16.19000,球 状 闪 电
474.54000,他们以为卧眠的是病狮
168.48200,亲中性命难保，他们没办法
309.90000,双航母还不至于一定开打，三航母就必须非常警惕了
905.23300,这句话泪目，当时真没意识到这条军演新闻的严峻性
867.65600,这句话还内涵了司马懿哈哈哈哈哈哈
1.52000,16年那年我也很紧张在服役
483.99800,不针对任何第三方国家和地区
525.31000,好家伙，叠buff呢这是，叠满了
540.93300,好家伙，叠buff呢这是，叠满了
471.25700,当年还在上学 政治老师上课提了这个事情 当时觉得轻描淡写 现在才知道有多凶险
162.18200,中情局: 选个死法吧
930.79300,感谢祖国我才有岁月静好的生活
318.87800,德国:签过的也一样
754.03600,不畏强敌，迎难而上！
923.73600,我们之所以看不到黑暗，是因为有人拼尽全力，把黑暗挡在了我们看不见的地方
47.29300,俄罗斯:？？？？
173.59500,重新定义自杀
540.49000,问问麦克阿瑟说过什么，再干。当年好面子来了一个“反向进攻”，真打起来，就该说美军投胎祈福去了
634.23500,那时候全网都是若有战召必回
640.26000,我一直以为是花干骨…
699.01200,这才是最关键的啊
38.35900,我在想当年如果真的打起来，海南会不会完了？被炸没了
395.38800,一百四十个小伙伴和我一样在看，当年我没有想过为什么演习，现在想想都后怕，祖国强大！
872.08400,奇怪的比喻增加了
101.33900,兔蹬鹰
37.76000,我好想记得，当时南海最危机的时候。
647.30200,我们真的是被一群最勇敢的人在保护着，知道，但是真的不知道当时已经这么严重了
88.36100,俄罗斯没有你们想象的那么强大
180.34900,莫迪老仙
267.70000,南海没了，观音菩萨上哪儿住去
685.92300,中国人总被他们中最勇敢的人保护的很好
236.94700,当年出了个名句啊，菲律宾里中国距离也很近
921.75400,《太阳照常升起》
888.10000,美国一直都像对付苏联一样，对中国也进行内部和平演变，但一直没成功，所以来外部了。
715.42000,航母坐标发现，躲反舰导弹的几率等于0。速度相差太大。咱们有北斗。不用GPS。干扰不了。
500.42500,中国火箭军的震慑力真不是给你开玩笑的。
205.01900,大自然的馈赠
276.64800,匈奴：要不是我被打成狗，我真信了
921.53200,哪有什么岁月静好，只是有人在替我们负重前行！
760.65900,日本：没错就是我（
810.08900,我海南的朋友说当时他们那坦克都开进来了…
511.01900,现在听都紧张到流泪
425.91800,想要跟鹰子在海上决战的
694.52400,致敬这些未知的英雄
101.11000,现在又举办了冬奥会
485.87500,中国这时候抱着光脚不怕穿鞋的，这是一种态度，也是一种无奈
2.00000,我的地理老师的朋友是退役海军，后来透露当时被召回了
834.84200,经典下克上，不愧招核男儿
65.33100,那兔说过，没签过的纸，都是厕所的S
834.30200,舰长:我聪明不？快夸我，快夸我~
291.93000,始皇陛下修长城，进可攻退可守，明辨华夷，使我辈得生
907.89500,此疫过后，世上再无美利坚
328.34000,不相信兔子还相信鹰么（doge）
286.57600,始皇震怒
258.89400,穷则独善其身，达则自古以来的
47.53800,审题嘛，冷战后
317.42000,德三：很抱歉，我签过两个都当厕所里的纸了
499.36100,菲律宾：喂喂喂！怎么不对劲？？？
812.18900,王伟!!
519.17300,信浓 当年我也很先进
98.58000,得到好处了
196.28000,所以中欧班列存在的意义凸现出来了
843.99000,古巴危机同款舰长
270.56900,以后有的是机会教你怎么去中立
523.86900,菲律宾:我是谁?我在哪?我要干什么?
51.33700,三航母时代考古！
771.32600,尊严只在剑锋之上，真理只在大炮射程之内！
786.13000,报销笑死了
479.53900,2022，小霉国时代变了！
259.05600,杜特尔特：大丈夫能屈能伸
55.77900,俄罗斯没了核武器算个屁
529.42500,中国三三制战术了解一下
282.15500,政哥粉狂怒
438.41800,《最终兵器，战略导弹核潜艇，承担核反击灭国任务》
687.19900,实力悬殊
906.27400,对！！说的好！！！！！！！！！
212.88200,代理人
0.99900,百看不厌
429.36200,英国：…
876.13700,《太阳照常升起》
290.59500,中立=工具人
279.51000,秦始皇:老子当时要不是没有船
657.95800,同桌的你
268.20100,早晚有一天，地球会彻底变成兔子的领星
803.06000,真理只在炮弹射程之内
872.97000,太阳照常升起
681.92800,那时候刚高考结束，原来我差点没有安稳的大学了
773.90000,杜哥出马
792.03000,果然是真理只在大炮的射程之内啊
819.08600,谁赢，他们帮谁
389.15800,说的我好想哭，我们崛起太不容易了！
913.74700,致敬
762.03300,手里的枪杆子就是真理！
12.51500,003航母下水了前来考古
703.94800,高手过招，点到为止
789.67900,我就记得菲律宾香蕉全填海了
513.10000,讲个笑话：美国最近几次战争打过哪个大国？
347.45300,现在我们有了003
431.42800,还有GTX690战术核显卡
871.16800,克林顿:你礼貌吗
838.11300,下克上
469.35300,2016到2022我们进步了太多了太多了……055
151.02500,真的是自杀吗
