time,danmu
821.22000,都是从抖音上来的吧
415.33700,南海仲裁那时候，铁路上运的武器坦克飞机图流传很广
55.68500,003也下水了
233.70000,草台班子来了
921.35400,加油，我爱你中国
754.30200,这是实战
657.66800,我有个同事是自主择业的空军军官，当时还在部队，也去了
18.64300,“美国称霸的最后一年”
496.72900,这是海湾战争以后美国的航母战斗群少有的戒备状态
313.46200,菲律宾欺负我们美国也要凑热闹 那就打！
94.74300,十个航母群来近海都得死
844.14000,感谢老美的程心
45.96200,那年我高考
378.79200,他们要打多久就打多久
21.74400,福建舰下水前来复习
894.09200,马克笔！漂亮国是在眼红咱中国吗，真是盐吃多了闲的！
915.10800,是有人升起黎明
699.58200,你敢打 巨浪也在盯你美国本土
28.69400,福建舰今天下水了
439.62000,六爷立功了
649.53100,东风浩荡，巨浪滔天
767.54000,菲猴:白皮中看不中用
24.49800,003已下水
658.59900,遗书都写好了……！
0.49200,我们不针对任何人，如果他真的是人。
653.05800,《同桌的你》暗示日本鬼子跟菲佣
726.03600,终于把顶部弹幕给消灭了！！！
357.61500,秦始皇：早知道就应该让长城有点西式风格了
770.99300,经过这场战争后，杜特尔特开始亲中，不再亲美
355.90000,当时我们确实是只有辽宁舰一个战舰，真的没有把握打的过美国
331.26000,其实这里很多国家都不相信中国，中国急需一场战争来让这些国家相信自己
294.65100,秦始皇：但凡有个地球仪，劳资不嗑仙丹，全世界都叫华夏
517.99800,快用RTX390战术核显卡！！！
156.19900,《论背后身中12枪是昏迷自杀这件事》
476.59600,隔空对线
279.63300,秦始皇：老子修长城的时候你美国在哪儿还不知道呢
313.96000,秦始皇：小子，我建立秦国时你还没出生呢。
47.57800,提古巴的，这里说了冷战之后
153.74000,被迫“自杀”
480.86800,美国退 ！退 !退 ！
379.82000,省吃俭用攒下来的家底，这句话破防了
670.09500,自新中国成立之后一直坚持御敌于国门之外
421.75600,“100百多艘”
584.03400,此生无悔入华夏
526.93400,老子打得就是精锐！！！
247.31800,现在菲律宾是中立但不亲中
496.38100,兔子说，你鹰将动手啊，鹰将说你动啊
763.30200,宇宙强国大韩:是我啦思密哒
584.18900,只有不怕死的人才能活下去
135.40000,CIA暗杀了不少欲摆脱控制的日本人
223.55300,几个菜啊。怎么喝成这样？
705.80800,不懂这个暗示的逻辑……
457.35400,鹰酱：兔子你玩真的
351.12600,陆战一师：当年我也是这么想的
122.11700,自己四处树敌也不假，霉国这是自己走上了钢丝
417.74200,海南:感谢各位来捧场！
119.42000,美国也从来没离开过亚太车
751.38000,哭了，和平的背后是有人替我们负重前行
625.86600,海军需要大量优秀老兵
307.93900,秦始皇说：但凡我有一个地球仪，你就是我的一个省
836.97800,美军舰长：卧槽。。。我不想作死。。。
614.10500,虽然官方没发什么消息，但是那时候网上有人发高速上在运送洲际导弹。
809.50200,若想手握和平，必先铸造利剑。
746.35300,当时的我：谁是敌？？
783.85900,哈哈哈哈哈好家伙
869.08500,鹰酱 大清亡了
857.68500,核：醒醒 该裂变了
146.51900,《怪事》
29.24700,1950年我们更弱，也能把他们赶回去，有信心在任何时间，任何地点，和美国碰一碰
458.38700,我估计已经加挂了核弹头
775.56200,对，那之后火箭军东风快递才广泛走入了社交视野
158.42000,他们可能把他杀理解成自杀了
464.26000,时隔半年再次重温这个视频，还是泪流满面
71.27100,全开进来大不了蘑菇预备
552.97100,直接超音速  战机   怼进去航母核动力舱室
693.69500,航母在菲律宾东面，进入无线电静默的攻击状态了
876.26600,太阳照常升起！
12.35900,每日亿遍
460.54800,菲律宾：当时我怕极了
739.51800,印度：正是在下
411.26800,当时的海军总共就四位
517.78300,航母再厉害，也不敢在近海和路基硬拼
897.70500,感谢我的国家把我保护得这么好
419.42200,贯口:报舰名
902.88500,真的是那句话 真理就在炮弹的射程范围内
358.83700,火箭军：在自己家门口还能让你飞咯？
622.66800,上面的这是无线电静默，这是开战前的准备
835.86400,舰长：莫名其妙拯救世界
14.60300,那年我刚好高中毕业，都不知道发生了这么大一件事
563.91200,航母最重要的是不能让人知道位置，自从有导弹后，航母就不再安全了
848.53200,如果是真的话哈里斯是真的疯了
530.47700,老子打的就是精锐
875.21900,当东方升起太阳，世界将不再需要灯塔
878.09000,这个比喻学到了
527.84200,老子打的就是精锐！
843.13700,传统工艺制作方法
734.34000,天呐我当年差点不能办喜酒！
175.84000,谢谢你的反向宣传，最后挖了自己人的坑
295.50100,当时真的做好了背水一战的准备 谁料老美最后怂了
455.53200,好家伙，拿出全力了
0.92100,再干一次联合国
84.37500,五常。我们都打了个遍
827.19600,麦克阿瑟：比我强，我都直接没了
827.87600,发配边疆哈哈哈哈哈哈
373.38000,触发被动：长城观望
616.87600,全频段阻塞干扰！！！
29.34100,助力100万赞
680.64200,向替我们负重前行的英雄们致敬
43.20600,俄罗斯：那我走？？？
136.43000,世界第三大和第二大经济体联盟 那真是想都不敢想
911.48400,吾辈当自强！
98.11300,现在过了这么多年美国还是能烂发美元，让世界买单
443.63900,这玩意基本就等于毛子今天的核武特殊战备了
532.71800,此次事件后，就给哈里斯免职了
847.34000,老谋深算，不愧是日本人
456.77500,东风快递，使命必达！
594.58000,这个有报道的！召回已经退伍转业的。
18.65600,97年才是最险的 可惜一个文职中将泄密
682.25300,哪儿有什么岁月静好，只是有人替我们负重前行！！！
259.35000,这边建议犁定一下印第安人历史地位呢
680.03900,你敢闯就叫你有去无回
324.56100,只要你敢过来老子就给你一梭子！
513.07100,老子打得就是最强
195.03600,日本没有选择，只能臣服爸爸，他摆脱不了了
855.59900,为中国骄傲！
870.73000,乌克兰:？？？
688.86700,印象中那个时候，经常听到上空传来飞机的声音
568.80000,额，就日本菲律宾的军舰对中国有什么影响吗
94.92600,兔子急了也是会咬人的
585.75800,对，当初都是这个海报。我去当海军的哥们已经在朋友圈说准备出征了
431.11000,听到自己家乡地区的舰队的名字都已经热血沸腾了
411.00600,但还是看新闻还是无比震惊的
480.66500,日韩菲新等一圈国家:你们来真的啊？
865.66200,当太阳从东方升起，世界将不再需要灯塔
784.57800,菲律宾;一顿饱和顿顿饱我还是分的清楚的
92.66000,美国并没有在中东获得自己想要的。石油霸权就算美国不打中东，也在它手上
76.29900,现在如果现在美国敢把所有航母战斗群都开进南海就好玩了，正好全歼省的以后闹腾。
278.98000,匈奴：要不是我被打成狗，我真信了
443.08300,近海作战，有岸基还是有抱我点那时候
806.24900,六爷永远是你六爷
647.93000,当时美国航母已经无线电静默了
162.04000,表面上是石原慎太郎在作祟，但…
210.95300,这个旗很有灵魂
752.91000,老美还是怕了东风快递啊哈哈哈哈
539.19600,好家伙！刻在DNA里的下克上
882.89300,但他们从未放弃从内部攻陷我们
249.49600,《一个历史还没中华菜谱厚的国家跟5000年文明古国提历史》
371.64200,省吃俭用攒下来的家底，这句话破防了
839.98000,日本：当年我就是这么玩死的
296.28000,嬴政：劳资有张地图就灭了你
632.45900,好图，形象生动
197.59500,敲黑板，划重点了：菜种起来了。
903.42800,我们之所以看不到黑暗，是因为有人拼尽全力，把黑暗挡在了我们看不见的地方
459.37800,当老实人没得玩时，他们会跟你玩命。
646.16500,我记得 那会上学的时候 经常看到武装直升飞机 飞过
325.17700,秦始皇：但凡老子有一张世界地图，也没现在的你了
619.34400,真的，仲裁结果出来后，美国媒体突然什么都不说了哈哈
879.75800,其实这次新冠，猴痘都可能是美国佬搞的鬼
204.42000,《种菜》
729.21500,鹰酱你别走啊
471.02200,不就是玩命吧 来吧
379.76300,感谢前辈
353.65300,想当初我们什么不是世界第一
581.70000,那就世界大战吧
441.92000,F15／俄亥俄：我们来看戏
408.65100,我爸当时眉毛紧皱（他当过兵）
359.49100,瓦良格……
892.76700,狭路相逢勇者胜
281.66200,川宝：你骂谁？
5.51900,003下水了
180.33600,不需要日韩，道不同不相为谋。
637.28200,？？？？？
435.34500,6爷！
488.51300,官兵都是已经写好遗书了
442.86800,没这些家底我敢和坂田正面硬碰硬？做梦吧
423.75600,宿迁
397.72800,勿谓言之不预
518.97300,老子打的就是精锐！！！！
769.10000,印度是不装了，摆烂了
396.00600,如果中国人都活不下去了，那还要地球干什么？！
5.26500,003下水了，055八艘了
846.25100,毕竟是日裔，白宫防了一手
644.30600,六公主听了回话 ？
456.95100,印象中好像是说导弹车满公路跑，经常被偶遇，以为就是演习，我幼稚了
311.74800,一四年我初三，当时我们政治老师跟我们讲那还问题，他分析的是真的透彻，讲了两节课还没讲完，大家都意犹未尽
907.20900,这句说的太好了
753.80000,全体起立
901.24600,所以要有智慧的打他
712.12500,航母暴露就会被东风精确打击直接摧毁的
731.92200,敬礼!!
647.98900,当时真的是啥都不懂啊
116.92300,听起来觉得真好笑
856.81100,战歌起
46.76000,本来就没俄罗斯的事，你这人非要带上俄罗斯，几个意思？
524.52100,老美就是纸老虎！
888.35800,2020印度事件
922.91300,吾辈当自强
712.00500,美国慌了
766.59000,老杜也上台了
315.84300,三哥:对
17.22000,那还放动画片，我们生活的土地重要还是短暂的快乐重要
86.26900,捞大发了，光石油就够赚了
263.52000,穷则搁置争议，达则自古以来
688.25000,我只记得股市跌得一塌糊涂
845.67300,垃圾上将没有指挥权
354.48100,然后海军叫来的火箭军
41.41500,海军四大将
299.39700,然后美国就在美墨边境修起了围墙
780.29900,唉
596.02500,江南一龙族
714.79500,还得是六爷出马
914.36600,致敬
514.73600,罪恶深重
421.17100,泪目
454.82000,真就是拼命了
106.21500,坚强中国，坚强汶川，这句话真戳人心
34.39000,003下水了！
878.28000,这个，加这个，能不能把事情办了！
253.88600,和谁讲历史呢你？？？
908.41300,忍令上国衣冠沦于夷狄，相率中原豪杰还我河山
506.21400,‘’‘’‘’‘’‘’‘’‘
432.92000,现在我国055大驱8艘了
280.70800,这时候我们媒体就和死了一样
842.29000,刻在DNA里的技能
501.19500,我们再也不用拼家底了呜呜呜
917.65000,致敬
254.93700,自古以来警告
353.06600,2022年 我们有仨啦
651.75300,当时的我还在每天早上抢华西产科的号
674.82900,陷阵之志，有死无生
621.83900,无线电静默了
835.65000,背黑锅罢了
4.67200,003下水了 再来回顾一遍
438.67600,003前来考古
54.34800,三航母了
908.09500,致敬
246.11000,南海观音震怒，
145.58000,若是不能在她成长之前毁灭她，那就要做好为她戴上皇冠的觉悟
381.66200,长城守望副本开启，请按任意键进入游戏
466.38800,712我生日
2.97900,我有个同事是自主择业的空军，当时已经去了
716.22900,seet you
262.21700,南海与你美国有何关系
55.13800,中国已经崛起
274.46000,推荐大家看一下UP主 衣戈猜想关于长城的视频，长城不只是一段城墙，其意义深远
8.57900,每日一遍，爱国无限！
793.71300,不是阿基诺，是阿基诺三世
353.93600,现在已经有第三艘航母了
369.81200,第三艘弹射航母下水了，高兴
883.68400,大家警惕，现在打舆论战，特别是男女对立特别厉害，要千万警惕
346.20600,2022年6月，003号航母福建舰下水 电磁弹射常规动力航母战力天花板！
3.88000,再来亿遍
604.62800,美国越战被打惨了，再来一次弄死你
913.01300,重振祖国荣光，我辈义不容辞！
483.39300,当时是准备直接核弹互殴的，南海开打随时可以开始三战
283.12400,巴西毕竟是金砖国家之一，印度也是
916.50300,必须三连
550.06200,麦克阿瑟大徒弟？（bushi）
5.18300,同志们，今天003福建舰下水啦
13.13900,003时代来考古
2.01900,2022年6月17日，中国第三艘航母福建舰下水
56.72800,我们有三航母了！！！！
204.07800,《海岛》
744.59300,只是以“南海方向战云密布”为借口掩盖了这场战争的事情
699.30000,要是美国敢对中国舰队开炮，中国可以直接锁定美国舰队，然后一炮打垮美国舰队
566.85900,当时大批日本战舰和菲律宾战舰都开到了南海
432.74000,海上我们把家底都开去南海了
43.29900,我真在现场，一级战备。抱着枪睡的。
631.39100,那个时候我已经做好准备参加了应征报名参军
675.83900,哪有什么岁月静好，只是有人在为我们负重前行
203.41200,这是大自然的馈赠
556.13900,美国四星上将 哈里斯下士
460.74300,战略摊牌、民族兴衰在此一举！
640.74000,动作指导：东京电视台
689.87000,实际从战争角度，美国航母被发现了，在菲律宾某个位置，我忘了具体方位，两个航母被锁
484.42800,菲律宾：woc你们来真的？？？
572.08200,NND，buff叠满了！！民族意识觉醒
344.34800,对整个北约宣战就宣战，整个北约基本约等于美国。你让美国来打试试。看看打不打美国本土？
246.44200,美国对北美洲占有，缺乏历史依据
553.14300,不愧是招核男儿
304.73900,政哥哥只缺一张世界地图，不然，有你美国出生？哈哈哈哈
476.28300,美国说你有大规模杀伤性武器你最好真有
474.34000,兔子要蹬鹰！
850.62200,这波我单杀送人头基地都不要了！！
317.50800,好家伙，太帅了
678.14000,师出之日，有死之荣，无生之辱
918.50500,中国只能赢 也只会赢
16.04000,每日一遍，爱国无边
518.88900,菲律宾：悲守穷庐，将复何及！
24.32300,快！上战术核显卡
543.16100,下  克  上
253.48200,你这要讲历史我可得跟你唠两句啊，我们中华上下五千年……
205.01900,“兔蹬鹰”
639.13100,那时候有两个已经退役的朋友突然被部队召回，当时说的是1个月训练，再具体的没跟我们说。
377.57100,嬴政：假如当时给我一张世界地图，这个世界叫什么还不一定呢
914.16800,我们之所以看不到黑暗，是因为有人拼尽全力，把黑暗挡在了我们看不见的地方
125.64200,日：那就没有我什么事了
663.17400,哪有什么岁月静好，只是有人在为我们负重前行！！！
856.30200,打起来我们的舰队只怕十不存一，但他们的航母从此就别想离开南海。
466.79800,《狗急跳墙》
344.62000,秦始皇：玛德，老子生早了，要不然对面是我的
134.82000,亚洲三巨头
879.54500,根 正 苗 红
840.84500,招 核 氚 铜
927.89500,中国人不屈不挠的精神极之伟大
796.27700,阿基诺的儿子这次又要上台了
425.95900,《报舰名》
648.84100,六公主永远那么有灵性
287.85500,秦始皇：你有种在我活着的时候说一次？你还能活着算我输。
831.99300,如果兔子和米帝打起来，最大受益者是泥虹国。
19.86700,这个拍的好
468.07100,从那之后，开启了海军下饺子模式
421.09500,请欣赏贯口《报舰名》
250.58800,笑死，最不缺的就是历史依据
456.86300,同是五常，你觉得的航母真逗群有威慑力吗？
306.15300,tm当年扩展版图的时候就应该都杀了
46.10400,当年我那退役两年每天游手好闲的小舅子突然开始早起跑步锻炼身体，等着军队召他回去打仗了。
830.25900,左 迁 哈 里 斯
35.69900,然后海军军费直线上升
773.91800,我说当年怎么菲律宾突然改口示好了
703.52800,这个图我还记得，当初以为就是一张巡视图而已
129.17800,还记得当时一个日本姑娘挺开心的跟我说这事，因为她嫁了中国人，
596.24700,原来这个图是这个意思
697.25000,简单来说就是“你已经死了”，如果你不信，东风21D首次实战
230.32000,大自然的鬼斧生工
712.08000,野生的棺材（美军航母）
510.35300,水滴：太拉了
893.93900,然后中国还能给你跳一个芭蕾
509.22000,这是核动力航母
640.95800,在初三补习班和老师一起等消息，当时就准备当童兵了
520.21100,当时初三补习，课都不上了和老师一起等仲裁结果
438.60200,中国愤怒的实力
111.92800,其实他们也没有忽视中国
692.98000,差的就是一个麦克阿瑟，下克上的行为
750.22300,轻描淡写到令人心疼
116.21900,当你意识到的时候，已经晚了
614.02200,听说他们都写好遗书了…真的想哭
830.39200,犹豫就会败北太对了
709.95300,轰六k：你大爷还是你大爷！
522.92800,李云龙：精锐？老子打的就是精锐！
373.65200,东风快递：你在教我做事？
897.66900,反战不反美，拜登啵你嘴
627.88000,宽宽
155.62500,.“自     杀”
328.27500,当时我们只能用战术核显卡
530.30000,老子打的就是精锐
915.62200,我们知道他们的伟大，却低估了他们的伟大
528.18600,老子打的就是精锐！
820.18800,兔子：我说这文件就这样了，谁赞成，谁反对
595.22800,只有不怕死的人，才配活着
62.52700,桌上放瓶二锅头？
410.16600,字数越少，新闻越短
573.48400,被缴了兵权
496.95100,跟美国正面刚，我们有这个优良传统
810.90000,就是要大方展示！军事摄影搞起来！
601.13000,从1840年开始，我们就是这么活下来的，太不容易了
373.37400,中国:这是底线，碰到就是毁灭
535.20000,老子打的就是精锐
404.77500,越南：我当时害怕极了
538.86500,兔子：精锐我又不是没打过
665.10400,这个比喻绝了
930.92000,这篇文章教科书级文章
521.55300,“任何个人和单位皆不可阻拦本调令”
702.27800,航母，潜艇，只要潜伏行动即可默认有敌意，可以先打再说
827.43400,《殖 民 地 总 督》
741.01300,当时看了这个节目，我还纳闷儿怎么用这种词呢，以为是假想红蓝军呢
486.38300,高情商：不针对任何人
249.59600,你要讲历史我可不困了啊
273.25700,始皇帝：老子玩长城的时候，你们祖先连个厕所都没煮
65.33100,那兔说过，没签过的纸，都是厕所的S
835.74600,舰长：卧槽你的还好老子留了个心眼
760.45800,印度：是我没错，我承认了
261.41500,《中  立》
483.34200,菲律宾：卧槽 你俩来真的？！
290.15800,秦始皇：老子造长城的时候，你们的祖宗还在树上呢
477.53400,来啊！互相伤害啊！谁还不是个五常啊！
431.03800,确实没排面，但你美爹夹着尾巴跑是不是面都不要了哈哈哈
346.18000,秦始皇：白起给老子张世界地图
657.60800,哪儿有什么岁月静好，只是有人替我们负重前行！！！
277.60600,嬴政：老子当年是没有船
715.62000,菲律宾:别走啊爸爸
651.15400,我检讨 当时我在夏威夷玩…
638.07700,垃圾桶形象生动
671.29900,CCTV：不能吓坏孩子
545.61600,以下克上，传统技能
338.33000,老大哥究竟还行不行
50.45900,考古那个！现在我们有三航母了！
740.47600,小老弟，碰一下？
520.04300,老子当时就被召回了，老子热血沸腾，誓要把这群鬼子打出去！！！！！！！！！！！！！！！！
457.40200,布牢里克
412.08000,《   北   洋   水   师   》
390.08000,标准－六：今天我就带着鱼叉前来看戏
136.76000,父慈子孝
18.66000,球状闪电／超新星纪元＿斯坦尼斯号都出现过
198.31500,海魂衫！
897.12600,我爱你 中国！
425.84500,为什么还没成都舰
771.55800,谁赢他们帮谁
189.75500,woc为啥有红警3的BGM
21.97400,必须消灭第七舰队
412.76000,以前局座讲过东风也有西方捧杀的因素
843.41100,传统下克上了
531.58900,懂了，传统下克上
511.21200,参加阿富汗战争（指开着舰艇上陆地）［doge］
436.08000,犯我中华者虽远必诛
494.11900,不针对任何美国
694.59500,发射小红人和战狼击沉美舰艇是吧
418.89300,结果全是GYLJ
462.49000,PS：那时候DFgua的是核弹头好像
279.91000,匈奴：太对了
757.05400,应该是瞄准了那些海外美军基地了
445.47800,换家 来吧
73.99300,这是……导师吗？
664.92400,中国当时算不上绝顶高手，那真是被逼上场的
91.52500,再强的航母也怼不过PLA的岸基火力
609.94000,米粉这种视频别那雷军来碰瓷OK？
429.02400,惠州，排面
562.02400,啊啊啊啊我已经听怕了
462.21400,咱氪金氪命一起来
0.00000,当时我爸所在的核弹基地已经瞄准美国了
551.73600,如果中国人都活不下去了，那还要地球干什么？！
307.24700,如果中国人都活不下去了，那还要地球干什么？！
368.11200,好委屈
499.74300,核战争没有赢家！！！！
118.41500,奥观海叛变了
262.99900,《忠    利》
277.73700,秦始皇：给我闭上你的大嘴巴子
109.22000,这真是一次机遇了
437.59000,当年沈阳飞机制造厂临时加班，飞机制造流水线随时启动，所有工作人员都没有回家
62.49600,说得好
354.03200,福建舰时代回来
896.18000,2022年003下水
430.65400,辽宁舰，山东舰，福建舰三只航妈
876.66000,不是怂，谁都不愿意打第一枪，
779.61700,敢来就炸菲律宾！
582.61200,不可能，我们哪次胜仗是靠装备，明明就是战术更胜一筹
510.59000,我为什么一点印象没有，哭了
700.71000,北斗:笑死，你在我眼皮子底下藏？哈哈哈
463.38600,兔子说 ：我si也要拉个垫背的
385.95300,火光一动，东风浩荡
759.56400,硬度：没有错，正是在下
508.70100,003~！
122.41200,不用美国，最后我们肯定内部爆破（毫无疑问的）
264.05400,现在已经不中立了
514.67300,不就是平直甲板我们现在也有了
130.61900,一个没历史的国家
174.47000,咱现在的混乱不也是美国搞得事
925.41900,只敬佩中国人民解放军
314.79800,找他这么说长城，美国岛链那才是真的低端
931.92000,致敬每一位解放军战士！！！
706.68800,下一秒df21就过去了
637.78000,朋友圈再转一点也不能少了
744.93700,印度人
97.29900,世界多极化
909.12400,人民英雄永垂不朽
826.61300,笑死我了拽大蛇
27.58400,加油
763.59000,手里的枪杆子就是真理！
234.85900,我说为啥菲律宾当时咬我们
826.58000,我的演习搞完了，那么谁赞成谁反对
49.61800,福建舰下水啦同志们！
842.37500,汪呜——
548.91400,汪汪
282.76300,匈奴：啊对对对
155.51900,2022年毒教材事件曝发，亚太战争也包括了毒教材！
838.15700,现代版麦克阿瑟
683.86900,让人想起了地中海美苏对峙和第二次古巴导弹危机
662.44100,祖国万岁
605.50000,泪目了
446.23100,家底都翻出来了
352.14000,2022回来的，003号已经下水了
533.91900,搁着debuff
377.44700,现在第一岛链内，我们没有对手了
142.58900,原来如此啊，货币互换还有这好处我是真不知道不学不知道
863.82800,我就说怎么这两年南海那边这么安静
873.34300,第三艘航母福建舰已经下水了
666.86500,士以进死为荣，退身为辱！
677.37800,致敬英雄
325.35300,老大哥到底行不行
122.72900,中国已经崛起
543.98800,日裔美国人？抗美抗日buff一起加上！
430.44200,广州牛逼
419.55000,泪目
446.10000,2022年
463.01400,美国试图再次开启炼狱级副本长城守望
52.92500,现在三个航母了
733.79900,菲律宾：100多艘战舰还有核潜艇导弹导弹在我家门口转悠，爹你走了我咋整啊！
5.07900,03下水了
667.04500,敬礼
829.11000,哈哈哈哈哈哈哈哈
165.26700,建议了解一下五眼联盟
315.10700,德三子：签过的也是
354.68600,今天003了
459.95400,掀桌的底牌
494.13100,猴子:麻烦问一下.他俩掐架 能不能离我家远点  我怕~~
654.26000,那个时候裹尸袋和遗书都写好了，因为当时真的就要开战了，战争一触即发
334.38000,美国也急需一场战争来向自己小弟展现自己的实力
833.28500,这tm就是打赢了的感觉啊
288.56300,秦始皇：我在修长城的时候你在干什么
537.49500,双重仇恨 双倍快乐【指打败敌人时】
735.84900,菲律宾的地位就和古巴一样尴尬
642.38000,东京电视台直呼内行（人家在日本里氏8.2级的地震中放动画片）
11.07100,好多人都不知道这件事
26.55300,确实远没有现在这么强大，我认真的，很多武器装备和现在都是代差。
175.40500,有谁注意到他脚上的白袜
93.37400,帝国坟场
454.69000,这个也看到了陆基导弹都拉出来待命了
156.21600,《突然昏迷身亡》
249.02200,《自我介绍》
734.09800,爷家书都写好了，最后写了个寂寞。
502.30800,当时会不会真的就少了菲律宾这个产香蕉的
287.95300,秦始皇：早知道我就把欧洲那边打下来
6.10300,再来亿遍
248.79600,这可是华夏，神明禁行
12.98600,我竟然才知道
