time,danmu
911.74000,我们看不见黑暗，是因为我们面相光明
31.42300,四大天王
652.78200,当时我还在玩游戏，真的是太傻了
332.27300,大明有强大的海军能打赢并建立殖民地什么的，大秦那时候科技太落后了
917.08800,加油啊啊啊啊啊啊啊啊！！！
671.02000,我当时被召回就想打个架，但是美国佬缩了，可惜
587.10400,我当时确实被召回了，我和我的兄弟们只想痛打鬼子！！！可是美国佬不敢！！！！
438.49900,[军火展示]
262.94500,《忠利》
260.45200,《忠利》
445.80200,来自2022年，福建舰下水了，我们也有电弹航母了
739.76700,隐晦，指战云密布
16.96000,！！！！
721.39200,光头：历史总是惊人的相识，还没打就撤
448.34000,现在052d已经8艘了
479.04300,如果中国人都活不下去了，那还要地球干什么？！
673.63000,尊严只在剑锋之上，（拍桌）真理只在大炮的射程范围
281.60500,这事儿干了3000年了，一直从春秋干到清朝
828.48100,···
381.92800,发布会喝二锅头，不愧是大佬 
889.95800,给我们的祖国点赞
672.74200,我真傻我不知道
107.93900,今天?
875.86000,当太阳从东方升起，世界将不再需要灯塔
728.13700,美国是想来炸我家么？啊！
806.91000,难怪我说近几年菲律宾好像风评又好了起来
178.04000,BGM：Europian storm，红色警戒3
572.62200,然后用核武器攻击就理所应当了，这是个开三战的绝妙借口
461.57000,md 热泪盈眶
930.58200,全中国！
378.41900,等等，那是二锅头？！
710.01700,航母编队高分六号看不到？非得预警机?
816.22000,危机也是转机
12.86300,我生日？
775.95500,龙龟:嘻嘻嘻嘻
50.64900,自南海之后 也改变了好多，美国再也不敢跟中国进行军事威胁和对峙了 中国海军还是爆发式发展 军舰下饺子
277.18300,你能建个长城，你也来啊
931.00000,003号航母下水了
32.58700,003前来报道
644.40800,？？？？
429.84300,梭哈了
878.99600,建国
587.15600,亮剑
416.91600,祖国万岁
395.24100,演习
429.66000,长沙舰
872.22100,笑死
255.88400,？？？？
916.55300,三连致敬
364.88100,别说以前，现在海军打也是必输
365.42000,从大西北沙漠戈壁起飞的导弹你拦截得了？
452.07200,那个时候才3艘052D吗。。。
719.04700,金色盾牌 热血铸就 峥嵘岁月何惧风流
513.49700,用雷球机枪（不是）
486.29700,↑中国：菲律宾，你不能走，回来！
357.22400,当时东风还是靠的GPS导航，美国一关闭GPS，东风就很难打中了
872.46500,乌克兰:熟
0.36000,003下水了
377.26200,火箭军：弟兄们，来活儿了，抓紧发货
6.12100,乌鸦校尉的工具人又名毒舌的南瓜。
362.21600,003
427.75300,潮州舰
430.55800,搭载东方21d，你值得拥有
480.73900,火力不足恐惧症，继续造航母吧
419.04000,卧槽，好踏马激动啊，流泪了
844.20500,下 克 上
802.34700,这就是战胜了
28.42000,我还记得那年我们被调往南海驻守
33.07700,2022年，003下水了！！！
119.14000,注意你的用词“什么大患？”
661.05500,那一年在上学的我也准备好要报名参军了
268.07600,联合国:我没有发言，美国说的
725.26500,东风17能拦住？反导也是有条件的
669.12900,我那时已经被动员到了，瀚海没滥德，沙地髀炊烟
412.66200,节目《报舰名》
24.62400,003号航母下水啦！！
43.58200,一级战备
85.46000,不是没捞到，是捞得差不多了，那帮资本家会玩没有回报的战争吗？
370.53800,亮剑
920.07500,今天003航母下水了，敬礼！
667.47500,中美一旦打起来必是世界大战
279.41700,吃不到葡萄说葡萄酸
49.68900,2022年回来的 俄罗斯真的8行
878.37600,乌克兰也是，只起到煽风点火的作用
347.16000,那时是积贫积弱的年代
34.87000,我们的电磁弹射航母下水啦！
650.28000,时刻准备发布全国动员令
5.06000,003福建舰下水啦！
873.27000,打的一拳开，免得百拳来！
753.58100,敢于亮剑！！！！
364.62100,第七舰队在亚太后边有个第三舰队就很恐怖 难对付
451.71100,即使过去了这么就，现在看仍然热血沸腾
833.26400,昨天中国第三艘航母下水了！
836.58800,这个舰长某方面也阻止了核战
65.69000,三航母下水报道
305.95800,中国3个航母了~
42.50000,？我那年还在玩泥巴
86.38000,还是有好处的，为的就是巩固美元霸权
32.40800,福建舰下水啦！！！
471.65600,你开枪 你开枪我也能先打死你
732.48300,这时候跟俄罗斯还不够铁
276.34500,巴铁二号
186.99100,{收到做到}
498.23800,里根号就是后面那个堵在苏伊士运河的那个吧
546.86500,麦克阿瑟:小哈，不要打台面，小心和我一样
417.94000,当时有300多艘舰队全部去南海支援去了，就是为了和美国抗衡
790.14200,菲律宾：要你何用！
631.69300,开始紫禁之巅了是吧
834.50200,也算是出将入相了（Doge）
391.32500,当时海南高速全面管制，可能为了运送物资
7.32000,每次看我都热血沸腾
251.35900,历史根据摞起来比某些国家厚了可能五倍不止
216.90000,大冤种出场了
636.92700,她们永远都不知道是谁保护着她们，天天做饭圈青年的
227.38000,注意CSIS
304.53100,690战术核显卡的那个笑死
46.49900,俄罗斯：两个？？
449.11700,拿出了世界大战的架势！不怕！
852.95000,沈总是真的厉害，我在役的时候他还来我们基地视察过
522.42200,久 经 沙 场
432.74800,不要怂，就是干！
348.63300,真理永远只在大炮的射程之内
192.36100,你玩狠了…咱航母也开始下饺子，咱又不是没钱，谁怕谁啊！
828.79500,四星上将去做驻韩大使哈哈哈哈哈哈哈
168.69900,碟中谍，黑石行动？
122.93700,这是地位要被超过了，谁不急，内卷就是这种心态，但他的做法不一样而已
814.39300,早这样不完了吗？包括但不限于这些军备！
237.81900,那一年 菲律宾差点没了
150.83600,《自殺》
278.24800,阿政：孙宰，教我做事吗
198.05700,鹰酱：他们在种菜？他们玩儿真的！
130.45900,日韩代表 一会儿之后就回国自杀了。
917.74700,我们之所以看不到黑暗，是因为有人拼尽全力，把黑暗挡在了我们看不见的地方
494.27900,只要打了菲律宾跑不了
327.14000,“谁赢他们帮谁”
5.34000,那个时候退伍兵都召回了，各地都在运送装备。就差打起来了
512.71300,美军陆战一师也号称自己久经沙场
923.75300,兔子总是拼命去保护好这个国家！
443.15600,当时能拿出的家底都拿出来了
485.13800,提着砍刀蹲在你家门口说不会针对你的
312.20100,秦始皇：哎！我就是不知道世界上还有那么个地方……要不然，都是我的
809.43300,长虹贯日、浩气长存呐！
710.59800,美鬼亡我之心不死！
123.26300,说实话川宝真的是好人
777.40700,行为指导：意呆利
363.05400,东风21:你说啥？
280.19400,秦始皇：这就焚书埋了你
121.70000,感谢中东兄弟送的飞机！
269.40200,"""老  中   立""了"
537.00800,让他跟五星上将迈克阿瑟谈谈
456.56800,在这个世界核武器不需要太准、
42.90800,是综合国力啦
390.87300,我姐夫当时就在某舰队，他打了个电话叫我姐屯米，现在才知道这么凶险
148.66000,《 自 杀 》
446.46000,轰  炸  洛  杉  矶
133.52400,中日韩这三角能形成自己体系，某神秘力量第一个看不下去
19.00700,哈里斯默默退出直播间
464.51700,听着其实心里好难过啊
666.85900,那一年，老父亲整整加了一年的班
51.98000,还好当年咱们顶住了 要不然后果不堪设想
821.63000,因为我们在战略上赢了！
478.63900,差点被美军的一个日裔美军航母舰长发动第三次世界大战
272.68800,巴西是不是甚至还有两百海里的领海
662.03300,同桌的你最精髓是不是那句：谁安慰爱哭的你 啊
223.23900,菲律宾籍美军(懂的都懂)
466.70100,压箱底的宝贝的拿出来了
635.61800,垃圾桶哈哈哈
504.96000,太不容易了我们，鼻子酸了
403.15000,消息越短，字越少
380.83000,核心利益：可以用核弹掀桌子的利益
46.00600,古巴导弹：那我呢？
695.54900,六爷立大功
725.95600,有古巴导弹危机内味了
450.09800,《来一颗》
512.77900,当年泰坦尼克也说的永不沉没
844.94500,舰长：快夸我英明
656.38000,真的致敬，致敬那些替我们负重前行
926.74000,哪有什么岁月静好，只是有人为我们负重前行
805.52000,六爷：爷看到你了
440.28500,热泪盈眶，祖国这是拿老底拼啊。国未复矣，我辈当自强！
23.81900,gtx690战术核显卡！！！！！！
254.10600,建议直接《自古以来》
8.63900,再来亿遍
340.31800,谁赢他们帮谁
147.06700,结果在美国无计可施的时候就开始给中国投毒了，但是没想到把自己也坑了
470.90000,不要觉得我们国家软弱，核心利益国家从未让步过！
799.26600,那二世祖已经挂了，挂时口中含着一支烟
883.29200,这个BGM总有一股鬼子的味儿
368.06100,东风：这么说，你很勇哦
3.55900,每日一遍
764.90400,俄罗斯：？？？嗝儿~是我酒还没醒咩？？
15.13900,那个时候刚高考完，真的那几天高铁运武器，真的紧张
811.47500,东风导弹射程之内皆是真理！！
174.47000,亲中的日本首相都下场凄惨
58.26000,当时在上学，只感觉局势有点不对，但当时老师都很紧张
333.93400,谁赢了他们帮谁
18.42200,要是中国再弱一点，估计霉国真敢开战，tm的
682.01500,师出之日，有死之荣，无生之辱！
549.79600,比麦克阿瑟如何？
389.24000,兔子蹬鹰
146.75400,美国：日本大臣随便啥？
648.65500,当年我刚好在师教导队，都要求战备，随时准备上，我们可是师后勤培训单位啊。都兴奋的不得了，能立功了
89.43400,《铁锁连环》
813.58700,以和(核)为贵
157.41400,《不明》
68.69300,兔子狡猾，都开进男孩...还不被你团灭了
160.05900,巧了，东京奥运也是几十上百亿亏没了然后财务负责人“自sha”
118.65900,韬光养晦，暗渡陈仓！
730.72900,真要打就是拼死也要把航母打沉，美国海上霸权同样不可持续
663.91000,无线电静默状态，开战的前端
328.62000,明白了，谁赢他们帮谁
417.12800,当时记得晚上播出了南海纪录片
11.57100,这个时间我刚好从省外回海南拿毕业证...
354.18800,另一半没有，但是地上的东风要不要？
373.37400,中国:5
13.26000,一遍一遍的复习
798.57200,菲律宾：要不要换个爸爸
414.48600,兔子：老子不过了！
771.33300,冷知识：杜特尔特是个精毛
909.03900,尊严只在剑锋之上，真理只在大炮射程之内
600.77000,麦克阿瑟的名言:只有不怕死的人才配活着
320.19600,原话？？？？？
539.48700,《日裔美国人》成分全了呀
413.66300,上初三时听到这个新闻真的是气的发抖，就想如果我再大一点就好了，这样我就去当女兵，保卫我的祖国
340.42000,胆子你是有的，但本事呢？
315.99700,德三：我签过的也一样
435.03700,这一波是真把家底大半都拿出来了。。
442.99900,这12枚巨浪可不是用来打航母、军舰的，这是用来威慑美国本土的，是二次核反击力量。
355.03300,苏联骂骂咧咧地退出了视频
296.41000,匈奴：要不是我被打成两半了，我就信了
571.28400,敌人像弹簧，你弱它就强
487.43400,项庄舞剑 意在沛公
460.98000,我兔子太难了吗的我要哭死
255.65900,中国：吼，你跟我唠这个我就不困了
209.98200,菲律宾的破旗子哈哈哈
427.10700,我就爱听报菜名，给我继续
268.36500,众所周知，中立＝墙头草
280.39900,秦始皇：WDNMD
278.39800,秦始皇：你在教我做事？
2.51900,养成好习惯，看视屏前先看简介
30.22400,这里是四名上将，字幕和配音出现了工作错误，工具人和后期已经在挨打了
597.73800,中国一点都不能少！
663.80000,致敬！
260.94200,笑死，和兔子谈历史
145.76700,《原来背后身中十多枪是自杀》
556.84600,有朋自远方来，呵呵，虽然必诛
760.94700,印度：正是在下
482.31400,美国舍不得陶家底，但我们必须掏
21.16000,五刷
166.03600,卧槽
426.95300,想哭了，兔子太不容易了
725.63200,当时据我们庆功会说的是天基武器锁定立功，导弹已经盯上了
248.69500,三百岁小孩跟五千岁巨龙比历史
868.59600,卧槽，我说怎么南海仲裁以后，菲律宾越南都老实起来了
361.43300,啊对对对，当年压倒性的劣势我们都翻盘了
127.65800,然后日本亲中的大臣在家“自杀”了
62.59100,“我没签字那就是废纸”
726.83300,当时打不起来，现在鹰酱更不敢打了
430.92400,过气网红052d（
775.98600,老杜这人能处
840.13000,下克上
297.19500,屠杀印第安人在历史上排第几
928.81000,感谢校尉，视频做得太好了
15.33700,二刷
927.86900,明犯我中华者，虽远必诛
82.47700,这还没捞到好处？？
425.16000,泸州舰
429.43800,看见运城舰了
0.42000,看《花千骨》
762.97800,如果中国人都活不下去了，那还要地球干什么？！
524.62200,菲律宾：我就是凑凑热闹，退出行不行呀
723.11100,打了的话，我们现在都不知道在哪里
463.25800,全部个球球！出动这点零头飞机就全部了？你拿咱们空军当什么了？
564.88300,这不是直接血脉压制了‘
442.70000,有055，8个了
7.79900,东梦那来的
658.66000,致敬
221.42000,越南极周边国家都是反骨仔，只有自己强大才是最重要的
186.88700,愿普天同乐
724.41100,不战而屈人之兵才是上策，乌克兰。战争表面看俄罗斯是痛快了，实际上呢
723.98800,美国本来就喜欢挑软柿子捏，大的他让小弟去得罪
46.29200,美国老想打我们
181.54000,BGM：The Europan Storm，红色警戒3
259.96000,哈哈2022年第三搜航母下水，6年时间发生了天翻地覆的变化，从此攻守异形了
774.02000,老杜来了
287.74500,秦始皇:我那时候你们还在流放
291.59200,我们有003了！！！
343.22800,现在看这个视频，我们有三艘了！
477.15900,波兰：菲律宾这个场景好像在那见过
2.11100,三胎时期穿越回来回顾！
904.63500,吾辈当自强!
390.57900,好希望那两艘航母能触礁
761.14500,印度：我还是藏不住了
494.29000,中国加油！中国万岁！
418.94100,都是家底啊，我们真的拼了我爱我的祖国！
762.29500,阿三:没错，正是在下
447.88500,。。。。
602.56000,向生而死，向死而生
55.59700,我是几万粉时关注的
903.08700,尊严只存在于剑锋之上，真理只存在于大炮射程之内
769.85500,物理说服，最是真理
357.13800,对，就算在现在，在远洋上能打败一半美国海军的只有另一半美国海军
247.87100,CNN
56.48000,96年，16年，看来二十年是个轮回，不知道等36年，我们是不是可以战胜美国。
720.12700,如果这南海战役打响了然后中国打赢的话那么我们的国际地位会更高更有话语权
669.74700,哪儿有什么岁月静好，只是有人替我们负重前行！！！
717.32800,人民英雄永垂不朽
157.71300,《不明》
557.22100,'''''
723.90100,既绝高下也决生死~
749.52800,不畏强敌，迎难而上！
922.96800,作曲：久石让……
540.05200,驻韩大使，哈里斯上鳖
847.20700,半岛总督是吧
315.82200,国际笑话：国际法庭制裁五常
13.51900,明明老师！！
285.93700,就是造了，怎么着了？
898.45200,就是因为外部的压力才有了内部的团结
254.95800,我有权的时候你还没出生呢，
866.87600,好像是哦
723.49900,我就问问美国敢打哪个大国？
319.32100,好！
896.14700,兔子：我不但在刀尖上跳舞，还给你来个空中叉劈加720度大回旋再平稳落回刀尖上，你气不气？
411.63500,都欺负到家门口害怕啥  
605.87300,搬出爷的东风
724.81900,从此之后南亚其他国家秒变乖巧温顺
435.39400,现在有福建舰!
891.96500,抖音过来的/20220623
428.22000,内容不错，就是声音读的听得太别扭
51.73000,2022年过来，我们三航母了
501.87800,缴过来改成李宝库号！
421.26000,弹幕护体
291.67100,如果大陆没有漂移地球大一统的局面或许就实现了
362.22200,中国火箭军进入直播间
662.67700,敌不动我不动，敌欲动，我先动
281.64500,中立只是等死罢了
313.09000,洪磊声音好好听！
26.42000,打仗不可能，对美国来说，不值当
611.24700,与美国来个鱼死网破。
361.13500,003电磁弹射航母下水了
537.97500,日裔？给中国加buff呢在这
360.44200,当时没有北斗，东风快递也不能保证精确命中，别忘了银河号
62.46800,三航母时代前来考古
278.03800,在自己家后院种地还要向你报备吗
360.24000,6年时间，3艘航母了
662.83900,致敬
1.24000,同志们！003福建舰下水啦！
427.85000,潮州排面
930.01200,003下水啦
725.75800,航母被发现了就什么都不是
883.84100,川建国！！！！
29.71300,福建已下水
870.18400,？？？？？
510.15000,福建舰
35.47600,感谢祖国解放军的守护！！
431.44200,湖南人表示骄傲hhh长沙，衡阳 ，岳阳
614.18700,大不了鱼死网破，拉着人类文明一起下葬（摊手）
701.26000,这场战争，还没有开战就已经输了战争
432.74000,空中很多飞机也去了南海，当时真的就要打起来了
33.42000,当时就差开炮了，最后还是美国怂了
279.40000,匈奴：要不是老子当年被长城打的TM那么惨，我还就真信了
257.52000,中国：要不是你们的历史都没我们的菜谱厚，我∴tm还真信了
749.92700,原来还有一层这样的背景啊，当时还奇怪为什么要这样报道
720.65300,武德充沛
232.77800,从地理的角度讲，菲律宾离中国还蛮近的哈
371.26500,其实只要一发高超音速导弹命中指挥台，航母的主舰就瘫痪了。战斗群就散了。
576.66600,兔子是真敢跟鹰酱打。以前一穷二白的时候敢，现在拼上家底还敢再来。
521.33500,菲律宾：你俩来真的？
594.92500,“不畏死，方可生”
151.43700,《突然自杀》
777.74000,我是杜特尔特态度突然大转弯开始猜测那年差点打了仗，但是不知道这么凶险
149.89900,《 自 杀 》
717.11400,关键是这几张照片，美军直接慌了，怕东风快递
102.15600,南海是本世纪内的一个焦点性问题，一定是也必然是
249.59300,《缺乏历史依据》
795.56000,菲律宾：我没得选啊
72.82000,如果可以尽量一下把老美是个航母全炸了
279.03300,秦始皇：老子当年要是知道你那一亩三分地，都给你收回来
919.96200,致敬背后默默保护我们的人!!
133.33100,《 父 慈 子 啸 》
214.18200,菲律宾：啊？
310.60000,但凡秦始皇还活着
835.49000,不愧是昭和男儿
11.73900,这个时候我在住院听同病房家属说要打仗了我以为在开玩笑没在意，没想到是真的
839.65500,白宫当时怕是吓得半死，真打起来的话自己就危险了
721.58900,如果那时中美打了，俄罗斯就是最大的受益者
452.86100,热泪盈眶，浑身颤抖
825.27500,感动到哭，祖国真的太难了
376.57700,都到家门口了还让到哪啊
10.65900,经过这次后中国大力发展海军，现在老美已经不敢随意的搞什么脑抽仲裁了。
716.06900,当时东风导弹已经做好饱和打击了，也就是说只要我发现了你航母的位置，你能拦截一个两个那我就朝你打七个八个把你打下来为止
591.62300,当时国家害怕人民群众担惊受怕所以cctv还放着动画片呢
367.83400,好心疼，我才知道这事！总是被兔子保护得太好了T_T
122.86400,热知识：美国不是亚洲国家。（去TMD重返）
641.17100,卧槽！很惭愧，真的一点都不知道
247.34000,南海问题新加坡也下场了
0.00000,瞬间就有点泪目
840.84500,昭 和 精 神
163.57000,只要中日韩有合作的意向肯定得出事，懂的都懂
371.28800,火箭军也不能保证自己能完成任务啊，导弹会被打掉的
492.43500,我感觉菲律宾才是最害怕的那个国家
214.75900,众所周知菲律宾是中国的固有领土
788.45200,中国：拉莫斯？红牌罚下！
173.05600,这个协议是真的可惜，如果成了，应该可以把美元霸权打开一个窗口
803.87000,六爷守护我们好多年了
543.62000,兔子：精锐算什么，老子连漂亮国的五星都抽过
484.28200,我能一刀削掉你的头皮屑，你且看我刀法如何！
527.89800,李云龙:劳资打的就是精锐
821.99900,真理只在大炮的射程之内！
329.15300,菲律宾把南海名字改成西菲律宾海，在菲律宾通用
210.69100,兔子：我就是个农民
131.91000,每次中日韩合作都会有些奇奇怪怪的事情分割各方
105.45300,太平洋舰队司令哈里斯回去就被撤了
729.65300,天呐 我当时竟然天天生活自在 什么都不知道 我的国 太不容易了
547.81400,昭  和  遗  风
848.81900,日籍美裔驻韩大使
26.86000,这五年时间到底发生了什么
714.86800,兔子：贼鹰你给我听着，我已经到黄岩岛了，这就过去抓你！你人呢？！
570.56500,让一步就是永远丢一步
47.72200,俄罗斯：你礼貌吗
180.20400,这协议当时要是成了，可就牛了
723.07800,狭路相逢勇者胜！
740.14500,战云密布的表述太可怕了
294.88000,秦始皇：小伙子挺勇啊，来人给爷抓去建长城
721.10200,应该是俄罗斯也有动作支援，航母开战有来无回
118.42600,中国有最大的美元储备用它们好多外企都被中国控股了
53.40000,当时人在美国读大学，真的就怕打起来
382.28000,看得我眼泪水都出来了，我们的祖国太不容易了。
520.17900,送去见的是列克星敦号，约克城号
219.04000,然后菲律宾的商品就没有卖出去过
653.28100,这个我知道，当时那张宣传图全网在转，都在说要开战
170.52500,CIA：不知道，不是我，别瞎说
7.05700,前方全程高能，注意这不是演习！
81.36600,你敢来我就让它们永远留在南海
92.26200,美式挖坑  一陷百陷
189.73900,中美，做对方的对手都够格
375.69400,可是东风31被间谍泄密了……
484.10900,我们的南海真的超级美 ，大家一定去看看
339.26200,原来当年经历过千钧一发的时刻，幸好我们顶住了
232.42500,肯定中国的啊！不然龙王住在哪
788.22500,这会又患上导弹恐惧症了，疯狂生产导弹
487.00000,菲律宾：来真的啊，蚌埠住了
239.94300,那可不是大哥，他恨不得叫爷爷
348.10000,小国家只能跟强者走，没办法，和乌克兰一样
629.86700,山雨欲来风满楼！
468.37200,听到全部家底真的哭了，穷怕了！
370.68500,东风-21：给我点面子
661.56600,在海南，当时挺小，但是明显能听到大人们都在讨论这件事，人心惶惶
739.48500,太隐晦了吧，我现在才知道这些细节！中国像个不想让孩子知道自己差点遇险的老父亲呜呜
441.67300,划重点，战略级核潜艇！
101.39600,那个时候真的万众一心
849.72400,打起来都是损失惨重，不明局势轻举妄动才是罪
266.73000,真正中立的组织美国早已退出，或者让它不再“中立”
20.45000,再来亿遍
466.70000,东风：不设 拒签 项。
364.94000,上去就是一百个东风快递，你俩航母拦截吧
588.15000,我当年是在上补习班公交车上听所有人都在讨论这个事才知道的
563.78500,美国以为咱们是虚张声势，但是咱们可没小看他们。咱们是实打实的严阵以待，一步不退！
430.45500,四位上将基本上是大战的准备了
817.78200,几十年后发现美国航母位置的人，真的很伟大
248.11000,中国现在穿上鞋了
618.14200,当时真的是刚出结果之后网上啥都没更新
496.06000,温馨提示，可以呼吸
325.36000,大国之争，小国都是谁赢他们帮谁
930.82600,哪有什么岁月静好，只不过有人在替我们负重前行。
598.40100,这句话是麦克阿瑟说的。。
139.80500,这个真的特别可惜，搞成了会给中日双方带来巨大的利益
826.50700,日裔美籍将军去韩国当驻韩大使，哈哈哈
816.32300,兔子：吓得我又填了几个岛压压惊
476.26700,全部家底真的好心酸，军力不足恐惧症
316.80400,成吉思汗当年有船现在就是中华人民共和球了
718.55800,航母被定位只有一个结果，就是死！
722.43200,2016年菲律宾杜特尔特猛男上台，狂怼美国转而和中国合作
523.62500,老子打的就是精锐!
826.83800,好    活    儿
646.79200,中国人民总是被这个国家最勇敢的人保护的很好！
703.04000,航母其实隐藏坐标就是进入战备了，但是中国这边发出照片就表示已经发现，美军就只能撤了
907.89500,此疫过后，世上再无美利坚
126.70600,猜猜这几天黄海的军事行动是怎么回事
611.04000,平头哥
881.74400,川宝！
637.61800,阿美莉卡怂了
470.83500,玩真的了
923.36700,致敬
290.78300,没人？
282.56200,一个两百多年的国家，理解我们这些壮举？无知！
25.40800,我们赢了。只是海军可能要同归于尽
639.65500,我当年就在看花千骨，完全不知道！
440.80300,八艘055都下水了
51.11900,俄罗斯有核，但没几个海军
69.52700,东风：你来我就让你变废铁
158.78200,安倍晋三来考古！！！！！！！
899.01400,BGM太阳照常升起
356.58000,因为航母编队是攻击属性的 离本土越近作用越小
502.74000,火箭军：全新的，还有这好事？
9.86000,大家好，我是南瓜
